### ISSUE TITLE
on-off switch type

### ISSUE THREAD

**Issue by danielkucera** [CrazYoshi/ebusdpy#2]
For switch type, my ebusd responds with "on", "off" value, not with 1,0 as expected here:

https://github.com/CrazYoshi/ebusdpy/blob/585d681eca95490c494ae700f0867f07f419d255/ebusdpy/ebusdpy.py#L74

```
22:43:09.008399 IP 127.0.0.1.35886 > 127.0.0.1.8888: Flags [P.], seq 1:34, ack 1, win 342, options [nop,nop,TS val 2144626475 ecr 2144626474], length 33
E..U<A@.@..`.........."............V.I.....
..g+..g*read -m 900 -c bai HeatingSwitch

22:43:09.008432 IP 127.0.0.1.8888 > 127.0.0.1.35886: Flags [.], ack 34, win 342, options [nop,nop,TS val 2144626475 ecr 2144626475], length 0
E..4..@.@._........."..............V.(.....
..g+..g+
22:43:09.009133 IP 127.0.0.1.8888 > 127.0.0.1.35886: Flags [P.], seq 1:5, ack 34, win 342, options [nop,nop,TS val 2144626475 ecr 2144626475], length 4
E..8..@.@._........."..............V.,.....
..g+..g+on
```
